song_title,artists,release_date,popularity,is_collaboration,duration_seconds,spotify_id,lyrics
Worth It.,RAYE,2023-02-03,75,False,246.813,7JgNAnCjJvL8hBR1kmCOFF,"Oh, no, no, no No, no, no Oh, pa-pa-ba-da I hope you're gonna Ooh, ooh, ooh, ooh No, no, no, no, my love, ah You're gonna make it worth I just wanna tell ya how I feel, woo! If my body was a boat, could you steer that, sailor? (Mmm) Make it feel like it's a 1960's Hollywood trailer (Old-school, I like) Classic like cars, classic like Elizabeth Taylor (Taylor, Taylor) Uh, need you to romance me, yeah, I need a giver, not a taker (Ooh, it's what I need, yes, 'cause) I could love you If I really wanted to You could be, be my glass of wine When the sun set, help me exhale all the excess Baby, bae, b-b-bae-b-b-baby, would you? Would you make it all right? (Mm) Or make it that much better? If you wantеd, you could make it all worth it, worth it, worth it, worth it Ooh, when I see the sun rising, you makе it that much better So I hope you're gonna make it all worth it, worth it, worth it, worth it Ooh, worth all of the time I'm 'bout to give you, baby So I hope you're gonna make it all worth it, worth it, worth it, worth it Ooh, give all of the time I should be working on me So I hope you're gonna make it all worth it, worth it, worth it, worth it (Mhm) This is the night (Something 'bout it's making me cry) My soul, it did decide (Feel my body shiver in your moonlight) And I need you to (Let me have the time of my life) Checked your credentials, South residentials Ooh, baby boy, you got so much potential I could love you If I really wanted to You could be, be my glass of wine When the sun set, help me exhale all the excess Baby, bae, b-b-bae-b-b-baby, would you? (Oh, baby, would you?) Would you make it all right? (Would you make it all right?) Or maybe that much better? (Maybe that much better babe) If you wanted, you could make it all worth it, worth it, worth it, worth it (If you wanted to, oh) Ooh, when I see the sun rising, you make it that much better So I hope you're gonna make it all worth it, worth it, worth it, worth it Ooh, worth all of the time I'm 'bout to give you, baby So I hope you're gonna make it all worth it, worth it, worth it, worth it Ooh, give all of the time I should be working on me So I hope you're gonna make it all worth it, worth it, worth it, worth it Drip me out in six-carat Cartier rings, baby (Babe) Top floor in the penthouse Sipping on Chardonnay 2016, baby (On the top floor) Something like a dream, baby Somehow I'm so captured by you I'm rearranging all of my plans And I'm holding my breath As I hope you make it worth it Would you make it all right? (Right) Or maybe that much better? (My baby) If you wanted you could make it all worth it, worth it, worth it, worth it Ooh, when I see the sun rising, you make it that much better So I hope you're gonna make it all worth it, worth it, worth it, worth it Ooh, worth all of the time I'm 'bout to give you, baby So I hope you're gonna make it all worth it, worth it, worth it, worth it Ooh, give all of the time I should be working on me So I hope you're gonna make it all (Worth it, worth it, worth it) This is the night (This is the night) My soul, it did decide (Worth it) And I need you too (I need you too) I'm all in, I can’t reverse it So I hope and pray you make it worth it (Ah, ooh, ah, yeah)"
Escapism. - Sped Up,"RAYE, 070 Shake",2022-12-07,72,True,239.888,3XCpS4k8WqNnCpcDOSRRuz,"Sleazin' and teasin', I'm sittin' on him All of my diamonds are drippin' on him I met him at the bar, it was twelve or something I ordered two more wines 'cause tonight, I want him A little context if you care to listen I find myself in a shit position The man that I love sat me down last night And he told me that it's over, dumb decision And I don't wanna feel how my heart is rippin' In fact, I don't wanna feel, so I stick to sippin' And I'm out on the town with a simple mission In my little black dress and this shit is sittin' Just a heart broke bitch, high heels six inch In the back of the nightclub, sippin' champagne I don't trust any of these bitches I'm with In the back of the taxi sniffin' cocaine Drunk calls, drunk texts, drunk tеars, drunk sex I was lookin' for a man who's on the same pagе Now it's back to the intro, back to the bar To the Bentley, to the hotel, to my old ways 'Cause I don't wanna feel how I did last night I don't wanna feel how I did last night Doctor, doctor, anything, please Doctor, doctor, have mercy on me Take this pain away You're askin' me my symptoms, doctor I don't wanna feel Toke this joint how I'm blowin' this steam Back to my ways like 2019 Not twenty-four hours since my ex did dead it I got a new man on me, it's about to get sweaty Last night really was the cherry on the cake Been some dark days lately and I'm findin' it cripplin' Excuse my state, I'm as high as your hopes That you'll make it to my bed, get me hot and sizzlin' If I take a step back to see the glass half-full At least it's the Prada two-piece that I'm trippin' in And I'm already actin' like a dick, know what I mean? So you might as well stick it in Just a heart broke bitch, high heels six inch In the back of the nightclub, sippin' champagne I don't trust any of these bitches I'm with In the back of the taxi sniffin' cocaine Drunk calls, drunk texts, drunk tears, drunk sex I was lookin' for a man who's on the same page Now it's back to the intro, back to the bar To the Bentley, to the hotel, to my old ways 'Cause I don't wanna feel how I did last night I don't wanna feel how I did last night Doctor, doctor, anything, please Doctor, doctor, have mercy on me Take this pain away You're askin' me my symptoms, doctor I don't wanna feel (What?) 'Cause I don't wanna feel like I felt last night I don't wanna feel like I felt last night Be at peace with the things you can't change (Last night) I'll be naked when I leave and I was naked when I came, yeah Out of reach, out of touch Too numb, I don't feel no way Toast up, so what? Street small, but it go both ways So, you'll run, yeah But you'll never escape Sunset in the maze (You're askin' me my symptoms, doctor, I don't wanna feel) I don't wanna feel how I did last night I don't wanna feel how I did last night, oh Doctor, doctor, anything, please Doctor, doctor, have mercy on me You're askin' me my symptoms, doctor I don't wanna feel I don't wanna feel how I did last night I don't wanna feel how I did last night Wanna feel, wanna feel how I did last night Lipstick smudged like modern art I don't know where the fuck I am or who's drivin' the fucking car Speeding down the highway sippin' Mixing pills with the liquor 'cah fuck these feelings I left everyone I love on read (Uh-huh) Spilling secrets to the stranger in my bed (Uh-huh) I remember nothing so there's nothing to regret (Uh-uh) Other than this 4/4 kick drum poundin' in my head"
BED,"Joel Corry, RAYE, David Guetta",2021-02-26,70,True,178.087,0siYMEsGrzzzlWLXK5zJfS,"I got a bed, but I'd rather be in yours, yours 9:05 in the evenin' I'm all up in my feelings I'm callin' your phone 'cause I can't get enough And I got work in the mornin' Early, early in the mornin' But who needs sleep when we're lovin' it up? Oh And why'd I gotta do this the hard way? My body wants to be in your arms, bae, baby Somethin' I'll regret in the mornin' But I just can't resist when you're callin' I got a bed, but I'd rather be in yours tonight I got a bed, but I'd rather be in yours, yours That's what I said when I called you on the phone tonight I got a bed, but I'd rather be in yours You know I sleep on the left side If you sleep on the left side I'd move to the right, yeah, I'd do it for you, oh-oh And I got work in the mornin' Early, early in the mornin' But who needs sleep when I'm rockin' with you? Oh And why'd I gotta do this the hard way? My body wants to be in your arms, bae, baby Somethin' I'll regret in the mornin' But I just can't resist when you're callin' I got a bed, but I'd rather be in yours tonight I got a bed, but I'd rather be in yours, yours That's what I said when I called you on the phone tonight I got a bed, but I'd rather be in yours I got a bed, but I'd rather be in yours tonight I got a bed, but I'd rather be in yours, yours That's what I said when I called you on the phone tonight I got a bed, but I'd rather be in yours Ooh Know I need your love Know I need your love, yeah Ooh Know I need your love Know I need your love Been way too long on the phone right now What you sayin'? Wanna roll right now? If you don't wanna be on your own right now Ring my phone 'cause I got a bed, but I'd rather be in yours tonight But I'd rather be in yours (Oh woah) I got a bed, but I'd rather be in yours tonight I got a bed, but I'd rather be in yours (I'd rather be in yours) That's what I said when I called you on the phone tonight I got a bed, but I'd rather be in yours Been way too long on the phone right now What you sayin'? Wanna roll right now If you don't wanna be on your own right now Ring my phone 'cause I got a bed, but I'd rather be in yours tonight I got a bed, but I'd rather be in yours, yours"
Prada (feat. D-Block Europe) - Valexus Remix,"cassö, RAYE, Valexus, D-Block Europe",2023-09-08,70,True,135.125,1hmI7H4W0ChPH6vfa9i2CQ,"'Bout to take my lady Selfridges New drip on the way, uh-huh Rap nigga still sellin' bricks Half a cake on the way, uh-huh Take a flight, she wanna take a Lyft Phone the molly man, he's on the way, uh-huh I might take her The Shard, I might take her The Ritz It don't matter, baby, I'm straight, uh-huh I feel like I'm in Prince's house Purple paint all on the walls, uh-huh Sittin' down on this fancy couch And I can't see straight, I'm a state, uh-huh Twenty-two, I'm in Paris, baby Got strippers tits in my face, uh-huh Pull up in a Bentley, I want Christian, I want Fendi I want Prada, ah-ah, ah-ah Ooh-ooh, ooh-ooh-ooh I already make that paper, I don't need to chase no clout, wow I don't usually pipe up, but I don't like how you runnin' your mouth, wow I already make that papеr, I don't need to chase no clout, wow I don't usually pipe up, but I don't like how you runnin' your mouth, wow You a sidе piece from east, then I'm a bad bitch from south, wow Baby, baby, I got more money comin' in than goin' out 'Bout to take my lady Selfridges New drip on the way, uh-huh Rap nigga still sellin' bricks Half a cake on the way, uh-huh Take a flight, she wanna take a Lyft Phone the molly man, he's on the way, uh-huh I might take her The Shard, I might take her The Ritz It don't matter, baby, I'm straight, uh-huh I feel like I'm in Prince's house Purple paint all on the walls, uh-huh Sittin' down on this fancy couch And I can't see straight, I'm a state, uh-huh Twenty-two, I'm in Paris, baby Got strippers tits in my face, uh-huh Pull up in a Bentley, I want Christian, I want Fendi I want Prada, ah-ah, ah-ah Ooh-ooh, ooh-ooh-ooh I already make that paper, I don't need to chase no clout, wow I don't usually pipe up, but I don't like how you runnin' your mouth, wow I already make that paper, I don't need to chase no clout, wow I don't usually pipe up, but I don't like how you runnin' your mouth, wow You a side piece from east, then I'm a bad bitch from south, wow Baby, baby, I got more money comin' in than goin' out I want Prada, ah-ah, ah-ah Ooh-ooh, ooh-ooh-ooh I want Prada, ah-ah, ah-ah Ooh-ooh, ooh-ooh-ooh"
Secrets,"Regard, RAYE",2020-04-24,68,True,176.766,66W1rVTnEv86dIkFhoiElg,"I don't know 'bout you, 'bout you 'Bout you, you-you-you-you-you There's something in his eyes He's keeping secrets I don't know 'bout you, bout you 'Bout you, you-you-you-you-you There's something in his eyes He's keeping secrets What a way to drop a bombshell baby Guess you really didn't think I'd found out Hear the silence crying In the room on the side with the lights out Know what you're feeling, oh-oh Know what you're feeling, oh-oh Fuckin' with my heart and head (And again and again and again and again) Fallen out of love again, yeah (And again and again and again and again) Rollin' up my blunt in bed (In my bed, in my bed, in my bed, in my bed) Fallen out of love again It's been a very, very long night Sittin' with my girls, sippin' wine like I don't know 'bout you, 'bout you 'Bout you, you-you-you-you-you There's something in his eyes He's keeping secrets I don't know 'bout you, bout you 'Bout you, you-you-you-you-you There's something in his eyes He's keeping secrets Oh-oh-oh, oh-oh, woah-oh Oh, oh I'ma have to take a mugshot, baby What you're doin' to me is criminal, out here On my knees, I'm prayin' In the room on the floor with the lights down Clothes in the kitchen, oh-oh-oh I'ma light it and leave it for you Fuckin' with my heart and head (And again and again and again and again) Fallen out of love again, yeah (And again and again and again and again) Rollin' up my blunt in bed (In my bed, in my bed, in my bed, in my bed) Fallen out of love again It's been a very, very long night Sittin' with my girls, sippin' wine like I don't know 'bout you, 'bout you 'Bout you, you-you-you-you-you There's something in his eyes He's keeping secrets I don't know 'bout you, bout you 'Bout you, you-you-you-you-you There's something in his eyes He's keeping secrets Oh-oh-oh, oh-oh, woah-oh I don't know 'bout you, 'bout you 'Bout you, you-you-you-you-you There's something in his eyes He's keeping secrets I don't know 'bout you, bout you 'Bout you, you-you-you-you-you There's something in his eyes He's keeping secrets"
Sports car,Tate McRae,2025-02-20,87,False,165.045,5UJbgR4XF4y1DvbkxEqe8S,"(Illegal) (Illegal) Hey, cute jeans Take mine off me Oh, golly gee I can't take no more I'm goin' weak in my knees Where'd you put those keys? We can share one seat We can share one seat In the alley, in the back In the center of this room With the windows rolled down Boy, don't make me choose In the alley, in the back In the center of this room With the windows rolled down Boy, don't makе me choose I think you know what this is I think you wanna uh No, you ain't got no Mrs.​ Oh, but you got a sports car We can uh-uh in it Whilе you drive it real far Yeah, you know what this is Yeah, you know what this is Pretty blue streetlights And my hazel eyes And if it feels right We could go again like three, four times So my type Got butterflies So good it hurts Thinkin' 'bout what we did before this verse On the corner of my bed Oh, and maybe on the beach You could do it on your own While you're lookin' at me I think you know what this is I think you wanna uh (Do you?) No, you ain't got no Mrs.​ Oh, but you got a sports car We can uh-uh in it (We can uh) While you drive it real far Yeah, you know what this is Yeah, you know what this is I think you know what this is (Oh) I think you wanna uh (You wanna) No, you ain't got no Mrs.​ Oh, but you got a sports car We can uh-uh in it (Uh-uh, uh-uh, mm) While you drive it real far Yeah, you know what this is Yeah, you know what this is Oh my guy You don't wanna waste my time (My time) Let's go ride (Let's go) Let's go ride (Come on) Oh my guy You don't wanna waste my time (You don't wanna waste my time) Let's go ride Let's go ride I think you wanna, wanna (Oh) But you got a sports car (Oh) While you drive it real far (Ah) Yeah, you know what this is"
Revolving door,Tate McRae,2025-02-21,91,False,180.032,541sN2qNfIlllGn9nGOQoC,"My cold heart is finally melting I moved from the east to the west wing I finally think it might be helping, oh, oh I confess, I'm not that versatile Say I'm good, but I might be in denial Takes one call and that undoes the dial (Ah) Baby, I tried to call you Off like a bad habit Tried to call you Off like a bad habit But I keep comin' back like a revolvin' door Say I couldn't want you less, but I just want you more So I keep comin' back like a revolvin' door Say I couldn't want you less, but I just want you more And more, and more And more, more (More) And more, and more And more, more (More) Shut it down That I tried, then you comе, come around Fuck me good, fuck me up, thеn I gotta move towns How'd I get from the gym to your couch? Oh, how? Baby, I tried to (Tried to) call you (Call you) Off like a bad habit (Yeah) Tried to (Tried to) call you (Call you) Off like a bad habit But I keep comin' back (Oh no) like a revolvin' door (Yeah) Say I couldn't want you less, but I just want you more But I keep comin' back (Oh no) like a revolvin' door (Yeah) Say I couldn't want you less, but I just want you more And more (Can't get what I want), and more (Can't get enough of) And more (You, when you make me), more (More) And more (Can't get what I want), and more (Can't get enough of) And more (You, when you make me), more (More) Change my mind so much I can't find it I work so much, can't be reminded Life feels worse, but good with you in it Supposed to be on stage, but fuck it, I need a minute Change my mind so much it's exhaustin' I still think 'bout that night out in Boston I'm more hurt than I would admit I'm supposed to be an adult, but fuck it, I need a minute (Oh) I need a minute, I need a minute (Ooh) I need a, I need, fuck it, I need a minute (I need a) I need a minute, I need a minute (Yeah) I need a, I need, fuck it, I need a minute I need a minute Ooh, I need a minute Mm Mm"
greedy,Tate McRae,2023-09-15,90,False,131.872,3rUGC1vUpkDG9CZFHMur1t,"(Woo) He said, ""Are you serious? I've tried, but I can't figure out I've been next to you all night and still don't know what you're about You keep ta- (Ta-ta-) talkin', but not much comin' out your mouth Can't you tell that I want you?"", I say, ""Yeah"" I would want myself Baby, please believe me I'll put you through hell Just to know me, yeah, yeah So sure of yourself Baby, don't get greedy That shit won't end well (No, it won't) End well (Uh-uh, uh-uh-uh, uh-uh, woo) I see you eyein' me down, but you'll never know much past my name Or how I'm runnin' this room around and that I'm still half your age Yeah, you're loo- (Loo-loo-) lookin' at me like I'm some sweet escape Obvious that you want me, but I said I would want myself Baby, please believe me I'll put you through hell Just to know me, yeah, yeah So sure of yourself Baby, don't get greedy That shit won't end well (No, it won't) End well He said, ""I'm just curious, is this for real or just an act? Can't tell if you love or hate me, never met someone like that Drive me so (So, so) crazy, did you know you got that effect?"" I said, ""Lemme check, yeah"" I would want myself Baby, please believe me I'll put you through hell Just to know me, yeah, yeah So sure of yourself Baby, don't get greedy That shit won't end well (No, it won't) End well (I would want myself) (I would want myself) I would want myself (I would want myself) (I would want myself) (Uh-uh, uh-uh-uh, uh)"
It's ok I'm ok,Tate McRae,2025-02-21,82,False,156.642,3OfqwyE7RrZrtuxCRixfII,"Mm Yeah, uh See you so excited (Mm) You got him locked down (Mmh, yeah) You're movin' like I did (Mm) Before I found out He ain't just a pretty-faced talker Good with his money, close to his mother You're seein' one-sided (Sided) You got him right now And she be like, ""He's so perfect"" I be like, ""Oh, what version?"" ""Ain't nobody got me this nervous"" Oh, baby, I been there (Hey) And right in that same position (Hey) So, baby, don't get this twisted (Hey) No, nothin' could make me miss it Take him, he's yours It's okay, I'm okay, had him in the first place It's okay, I'm okay (I'm okay, yeah, yeah) It's okay, I'm okay, I don't really gotta say It's okay (Okay) You can have him anyway (Way) Anyway (Way) You can have him anyway (Way) Anyway (Oh, oh, oh, oh) Was such a romantic (Romantic) You got me like, ""Fuck that"" Some months and some long flights Now I can't go near that And she be like, ""He's so perfect"" I be like, ""Oh, what version?"" ""Ain't nobody got me this nervous"" (Nervous) Oh, baby, I've been there (Hey) And right in that same position (Hey) So, baby, don't get this twisted (Hey) No, nothin' could make me miss it Take him, he's yours It's okay, I'm okay, had him in the first place It's okay, I'm okay (I'm okay) It's okay, I'm okay, I don't really gotta say It's okay (Okay) You can have him anyway (Way) Anyway (Way) You can have him anyway (Way) Anyway (Way, way, way) It's okay, I'm okay, had him in the first place It's okay, I'm okay (I'm okay, I'm okay) It's okay, I'm okay, I don't really gotta say (It's okay) It's okay You can have him anyway (Anyway) Anyway (Anyway) You can have him anyway (Anyway) Anyway (Oh, oh, oh, oh) I don't want him anyway, girl, take him I don't want him anyway, girl, take him I don't want him anyway, girl, take him (It's okay, take him) I don't want him (Yeah, I don't), I don't want him (Yeah, I don't) I don't want him (Anyway) anyway, girl, take him (Want him anyway) I don't want him (Anyway) anyway, girl, take him (Anyway) I don't, it's okay, it's okay, take him (Anyway) I don't want him (Yeah, I don't), I don't want him"
I know love (feat. The Kid LAROI),"Tate McRae, The Kid LAROI",2025-02-21,84,True,156.222,4xvEn1vhrF9JbPFWqTXsH4,"He said, ""No lie, girl, you lookin' sexy on the magazine, but what you doin' after the photos?"" Looks like I'll be in the covers with you practicin' a new kinda promo I said, ""Baby, if you want, I'll give you somethin' you can hold on, you can feel for now, yeah"" I said, ""Baby, if you want, I'll give you somethin', but you only got me right now,"" because I know love when it hits, when it hits, when it hits Yeah, I know love, yeah Yeah, I know love when it hits, when it feels like this It's a little like drugs Got you sick in the mornin', down on your knees Yeah, you're so fucked up fallin' for me I know love when it hits, when it hits, when it hits Yeah, I know love, I know love We started off friends, how we end up here? I don't know, but I don't see no problems We started off friends, how you end up here next to me? (Honestly, this shit is crazy) I said, ""You my type,"" out in Mexico tonight You said it was gon' be quick, now we're twelve months in, so Everybody needs somebody they can hold down (Mm, yeah) Girl, stop actin' like you're tough and let your guard down I know love when it hits, when it hits, when it hits Yeah, I know love, yeah (I know love) Yeah, I know love when it hits, when it feels like this It's a little like drugs Got you sick in the mornin', down on your knees Yeah, you're so fucked up fallin' for me I know love when it hits, when it hits, when it hits Yeah, I know love, I know love When it hits, I kn-kn-kn-kn-know When it hits, I kn-kn-kn-kn-know love When it hits, I kn-kn-kn-kn-know When it hits, I kn-kn-kn-kn-know love (When it hits like that) When it hits, I kn-kn-kn-kn-know (I know love) When it hits, I kn-kn-kn-kn-know love (I know love) When it hits, I kn-kn-kn-kn-know (I know love) Yeah, I know love, I know love New love, new plans, new script Yeah, it's only the beginnin', but it's happening quick, boy (Mm) New nails, new hair, new tricks New positions that I put you on and then I put you in, like (Yeah, oh no) I know love when it hits, when it hits, when it hits Yeah, I know love, yeah (I know love) Yeah, I know love when it hits, when it feels like this It's a little like drugs Got you sick in the mornin', down on your knees Yeah, you're so fucked up, falling for me I know love when it hits, when it hits, when it hits Yeah, I know love, I know love Oh, mm When it hits, when it hits"
you broke me first,Tate McRae,2021-03-26,86,False,170.226,4l0RmWt52FxpVxMNni6i63,"You broke me first, ah Maybe you don't like talkin' too much about yourself But you shoulda told me that you were thinkin' 'bout someone else You're drunk at a party or maybe it's just that your car broke down Your phone's been off for a couple months, so you're callin' me now I know you, you're like this When shit don't go your way, you needed me to fix it And like me, I did But I ran out of every reason Now suddenly, you're askin' for it back Could you tell me, where'd you get the nerve? Yeah, you could say you miss all that we had But I don't really care how bad it hurts When you broke me first You broke me first Took a while, was in denial when I first heard That you moved on quicker than I coulda ever, you know that hurt Swear for a while, I would stare at my phone just to see your name But now that it's there, I don't really know what to say I know you, you're like this When shit don't go your way, you needed me to fix it And like me, I did But I ran out of every reason Now suddenly, you're askin' for it back Could you tell me, where'd you get the nerve? Yeah, you could say you miss all that we had But I don't really care how bad it hurts When you broke me first You broke me first What did you think would happen? What did you think would happen? I'll never let you have it What did you think would happen? Now suddenly, you're askin' for it back Could you tell me, where'd you get the nerve? Yeah, you could say you miss all that we had But I don't really care how bad it hurts When you broke me first You broke me first (You broke me first) You broke me first, ah"
