song_title,artists,release_date,popularity,is_collaboration,duration_seconds,spotify_id,lyrics
What Do You Mean?,Justin Bieber,2015-11-13,84,False,205.68,4B0JvthVoAAuygILe3n4Bs,"What do you mean?  Oh, oh When you nod your head yes, but you wanna  say no What do you mean?  Hey, yeah When you don't want me to move, but you tell me to go What do  you mean? Oh,  what do you mean? Said you're runnin' outta time,  what do you mean? Oh, oh, oh, what do you mean? Better make up your mind, what do you mean? You're so indecisive of what I'm sayin' Tryna catch the beat, make up your heart Don't know if you're happy or complainin' Don't want for us to end, where do I start? First you wanna go to the left, then you wanna turn right (Right) Wanna argue all day, makin' love all night (All night) First you're up, then you’re down, and then  between ('Tween) Oh, I really wanna know What do you mean? Oh, oh When you nod your head yes, but you wanna say no What do you mean? Hey, yeah When you don't want me to move, but you tell me to go What do you mean? Oh, what do you mean? Said you're runnin' outta time, what do you mean? Oh, oh, oh, what do you mean? Better make up your mind What do you mean? You're overprotective when I'm leavin' Tryna compromise, but I can’t win You wanna make a point, but you keep preachin' You had me from the start, won't let this end First you wanna go to the left, then you wanna turn right (Turn right) Wanna argue all day, makin' love all night (All night) First you're up, then you’re down, and then between ('Tween) Oh, I really wanna know What do you mean? Oh, oh (Yeah, yeah, yeah, yeah) When you nod your head yes, but you wanna say no What do you mean? (Oh, what do you mean?) Hey, yeah When you don't want me to move, but you tell me to go What do you mean? (I wanna know, ooh) Oh, what do you mean? (Ooh) Said you're runnin' outta time, what do you mean? (Oh, baby) Oh, oh, oh, what do you mean? Better make up your mind What do you mean? (Don't be so selfish, baby, yeah, yeah) Oh, oh When you nod your head yes, but you wanna say no What do you mean? (You're so confusin', baby) Hey, yeah When you don't want me to move (Hey), but you tell me to go What do you mean? (Be more straightforward) Oh, what do you mean? (Hey, ah, ah, ah) Said you're runnin' outta time, what do you mean? (Hey, ah, ah, ah) Oh, oh, oh, what do you mean? Better make up your mind, what do you mean?"
bad guy,"Billie Eilish, Justin Bieber",2021-08-18,62,True,194.839,69u7FJV6RIbQS3VuqLPSwl,"Hmm, da-da-da-da-da Da-da-da, hmm Da-da-da-hmm (Yeah, yeah) Oh, ah White shirt now red, my bloody nose Sleepin', you're on your tippy toes Creepin' around like no one knows Think you're so criminal Bruises on both my knees for you Don't say thank you or please I do what I want when I'm wanting to My soul so cynical So you're a tough guy Like it really rough guy Just can't get enough guy Chest always so puffed guy I'm that bad type Make your mama sad type Make your girlfriend mad tight Might seduce your dad type I'm the bad guy Duh I'm the bad guy Gold teeth, my neck, my wrist is froze (So icy) I got more ice than, than the snow That guy, don't act like you don't know That guy, so critical (Skrrt) Tattoos on both my sleeves Yeah, I don't sleep, please don't wake me Loosen my tie up so I can breathe It ain't political, oh no (Uh-uh) Yeah, I'm a bad guy Ain't no holdin' back guy Come off like I'm mad guy Always got your back guy Yeah, I'm the real type Keep you full of thrills type Show you what it feels like Got an open invite I'm the bad guy, woah-ooh (Duh) I'm the bad guy Duh I'm only good at bein' bad, bad (Ahh) (Ah) I like when you get mad I guess I'm pretty glad that you're alone (So icy) You said she's scared of me? I mean, I don't see what she sees But maybe it's 'cause I'm wearing your cologne (Let's go) I'm a bad guy (Damn right) I-I'm a bad guy (Bad guy, aw, yeah, bad guy) I'm a bad..."
I Don't Care,"Ed Sheeran, Justin Bieber",2024-09-27,71,True,219.946,6hvRoJ0BTZywxu8UCPBkzx,"I'm at a party I don't wanna be at And I don't ever wear a suit and tie, yeah Wonderin' if I could sneak out the back Nobody's even lookin' me in my eyes Then you take my hand Finish my drink, say, ""Shall we dance?"" (Hell, yeah) You know I love ya, did I ever tell ya? You make it better like that Don't think I fit in at this party Everyone's got so much to say (Yeah) I always feel like I'm nobody, mmm Who wants to fit in anyway? 'Cause I don't care when I'm with my baby, yeah All the bad things disappear And you're making me feel like maybe I am somebody I can deal with the bad nights When I'm with my baby, yeah Ooh, ooh, ooh, ooh, ooh, ooh 'Cause I don't care as long as you just hold me near You can take me anywhere And you're making me feel like I'm loved by somebody I can deal with the bad nights When I'm with my baby, yeah Ooh, ooh, ooh, ooh, ooh, ooh We at a party we don't wanna be at Tryna talk, but we can't hear ourselves Read your lips, I'd rather kiss 'em right back With all these people all around I'm crippled with anxiety But I'm told it's where I'm s'posed to be You know what? It's kinda crazy 'cause I really don't mind When you make it better like that Don't think we fit in at this party Everyone's got so much to say, oh yeah, yeah When we walked in, I said I'm sorry, mmm But now I think that we should stay 'Cause I don't care when I'm with my baby, yeah All the bad things disappear Yeah, you're making me feel like maybe I am somebody I can deal with the bad nights when I'm with my baby, yeah Ooh, ooh, ooh, ooh, ooh, ooh (Oh yeah, yeah, yeah) 'Cause I don't care as long as you just hold me near You can take me anywhere And you're making me feel like I'm loved by somebody I can deal with the bad nights when I'm with my baby, yeah Ooh, ooh, ooh, ooh, ooh, ooh (No) I don't like nobody but you, it's like you're the only one here I don't like nobody but you, baby, I don't care I don't like nobody but you, I hate everyone here I don't like nobody but you, baby, yeah 'Cause I don't care (Don't care) When I'm with my baby, yeah (Oh yeah) All the bad things disappear (Disappear) And you're making me feel like maybe I am somebody (Maybe I'm somebody) I can deal with the bad nights (With the bad nights) When I'm with my baby, yeah Ooh, ooh, ooh, ooh, ooh, ooh (Oh yeah, yeah, yeah) 'Cause I don't care as long as you just hold me near (Me near) You can take me anywhere (Anywhere, anywhere) And you're making me feel like I'm loved by somebody (I'm loved by somebody, yeah, yeah, yeah) I can deal with the bad nights When I'm with my baby, yeah (Ooh) Ooh, ooh, ooh, ooh, ooh, ooh"
Die With A Smile,"Lady Gaga, Bruno Mars",2025-03-07,90,True,251.667,7so0lgd0zP2Sbgs2d7a1SZ,"(Ooh, ooh) I, I just woke up from a dream Where you and I had to say goodbye And I don't know what it all means But since I survived, I realized Wherever you go, that's where I'll follow Nobody's promised tomorrow So I'ma love you every night like it's the last night Like it's the last night If the world was ending I'd wanna be next to you If the party was over And our time on Earth was through I'd wanna hold you just for a while And die with a smile If the world was ending I'd wanna be next to you (Ooh, ooh) Ooh, lost, lost in the words that we scream I don't even wanna do this anymore 'Cause you already know what you mean to me And our love's the only war worth fighting for Wherever you go, that's where I'll follow Nobody's promised tomorrow So I'ma love you every night like it's the last night Like it's the last night If the world was ending I'd wanna be next to you If the party was over And our time on Earth was through I'd wanna hold you just for a while And die with a smile If the world was ending I'd wanna be next to you Right next to you Next to you Right next to you Oh-oh If the world was ending I'd wanna be next to you If the party was over And our time on Earth was through I'd wanna hold you just for a while And die with a smile If the world was ending I'd wanna be next to you If the world was ending I'd wanna be next to you (Ooh, ooh) I'd wanna be next to you"
Abracadabra,Lady Gaga,2025-03-07,87,False,223.398,2LHNTC9QZxsL3nWpt8iaSR,"Abracadabra, abracadabra Abracadabra, abracadabra Pay the toll to the angels Drawing circles in the clouds Keep your mind on the distance When the devil turns around Hold me in your heart tonight In the magic of the dark moonlight Save me from this empty fight In the game of life Like a poem said by a lady in red You hear the last few words of your life With a haunting dance, now you're both in a trance It's time to cast your spell on the night ""Abracadabra, amor-oo-na-na Abracadabra, morta-oo-ga-ga Abracadabra, abra-oo-na-na"" In her tongue she said, ""Death or love tonight"" Abracadabra, abracadabra Abracadabra, abracadabra Feel the beat under your feet, the floor's on firе Abracadabra, abracadabra Choose the road on the wеst side As the dust flies, watch it burn Don't waste time on a feeling Use your passion, no return Hold me in your heart tonight In the magic of the dark moonlight Save me from this empty fight In the game of life Like a poem said by a lady in red You hear the last few words of your life With a haunting dance, now you're both in a trance It's time to cast your spell on the night ""Abracadabra, amor-oo-na-na Abracadabra, morta-oo-ga-ga Abracadabra, abra-oo-na-na"" In her tongue she said, ""Death or love tonight"" Abracadabra, abracadabra Abracadabra, abracadabra Feel the beat under your feet, the floor's on fire Abracadabra, abracadabra Phantom of the dance floor, come to me Sing for me a sinful melody Ah, ah, ah Ah, ah, ah ""Abracadabra, amor-oo-na-na Abracadabra, morta-oo-ga-ga Abracadabra, abra-oo-na-na"" In her tongue she said, ""Death or love tonight"""
Poker Face,Lady Gaga,2008-01-01,86,False,237.2,1QV6tiMFM6fSOKOGLMHYYg,"Mum-mum-mum-mah Mum-mum-mum-mah Mum-mum-mum-mah Mum-mum-mum-mah Mum-mum-mum-mah I wanna hold 'em like they do in Texas, please (Woo) Fold 'em, let 'em hit me, raise it, baby, stay with me (I love it) LoveGame intuition, play the cards with spades to start And after he's been hooked, I'll play the one that's on his heart Oh, woah-oh, oh, oh Oh-oh-oh-oh-oh-oh I'll get him hot, show him what I've got Oh, woah-oh, oh, oh Oh-oh-oh-oh-oh-oh I'll get him hot, show him what I've got Can't read my, can't read my No, he can't read my poker face (She's got me like nobody) Can't read my, can't read my No, he can't read my poker face (She's got me like nobody) P-p-p-poker face, f-f-fuck her face (Mum-mum-mum-mah) P-p-p-poker face, f-f-fuck her face (Mum-mum-mum-mah) I wanna roll with him, a hard pair we will be (Woo) A little gamblin' is fun when you're with me (I love it, woo) Russian roulette is not the same without a gun And baby, when it's love, if it's not rough, it isn't fun, fun Oh, woah-oh, oh, oh Oh-oh-oh-oh-oh-oh I'll get him hot, show him what I've got Oh, woah-oh, oh, oh Oh-oh-oh-oh-oh-oh I'll get him hot, show him what I've got Can't read my, can't read my No, he can't read my poker face (She's got me like nobody) Can't read my, can't read my No, he can't read my poker face (She's got me like nobody) P-p-p-poker face, f-f-fuck her face (Mum-mum-mum-mah) P-p-p-poker face, f-f-fuck her face (Mum-mum-mum-mah) (Mum-mum-mum-mah) (Mum-mum-mum-mah) I won't tell you that I love you Kiss or hug you 'Cause I'm bluffin' with my muffin I'm not lyin', I'm just stunnin' with my love-glue-gunnin' Just like a chick in the casino Take your bank before I pay you out I promise this, promise this Check this hand 'cause I'm marvelous Can't read my, can't read my No, he can't read my poker face (She's got me like nobody) Can't read my, can't read my No, he can't read my poker face (She's got me like nobody) Can't read my, can't read my No, he can't read my poker face (She's got me like nobody) Can't read my, can't read my No, he can't read my poker face (She's got me like nobody) Can't read my, can't read my No, he can't read my poker face (She's got me like nobody) Can't read my, can't read my No, he can't read my poker face (She's got me like nobody) P-p-p-poker face, f-f-fuck her face P-p-p-poker face, f-f-fuck her face (She's got me like nobody) P-p-p-poker face, f-f-fuck her face (Mum-mum-mum-mah) P-p-p-poker face, f-f-fuck her face (Mum-mum-mum-mah) P-p-p-poker face, f-f-fuck her face (Mum-mum-mum-mah) P-p-p-poker face, f-f-fuck her face (Mum-mum-mum-mah)"
Just Dance,"Lady Gaga, Colby O'Donis",2008-01-01,84,True,241.933,1dzQoRqT5ucxXVaAhTcT0J,"Truth! RedOne Konvict Gaga (Oh-oh, eh) I've had a little bit too much, much (Oh, oh, oh-oh) All of the people start to rush (Start to rush by) A dizzy twister dance, can't find my drink or man Where are my keys? I lost my phone, phone (Oh, oh, oh-oh) What's goin' on, on the floor? I love this record, baby, but I can't see straight anymore (Woo) Keep it cool, what's the name of this club? I can't remember, but it's alright, a-alright Just dance Gonna be okay, da-da-doo-doot-n Just dance Spin that record, babe, da-da-doo-doot-n Just dance Gonna be okay Da-da-da-dance, dance, dance Just, j-j-just dance Wish I could shut my playboy mouth (Oh, oh, oh-oh) How'd I turn my shirt inside out? (Inside out, right) Control your poison, babe, roses have thorns, they say And we're all gettin' hosed tonight (Oh, oh, oh-oh) What's goin' on, on the floor? I love this record, baby, but I can't see straight anymore Keep it cool, what's the name of this club? I can't remember, but it's alright, a-alright (Woo) Just dance Gonna be okay, da-da-doo-doot-n Just dance Spin that record, babe, da-da-doo-doot-n Just dance Gonna be okay Da-da-da-dance, dance, dance Just, j-j-just When I come through on the dance floor, checking out that catalogue (Hey) Can't believe my eyes, so many women without a flaw (Hey) And I ain't gon' give it up, steady, tryna pick it up like a call (Hey) I'ma hit it, I'ma beat it up, latch onto it until tomorrow, yeah Shorty, I can see that you got so much energy The way you twirlin' up them hips 'round and 'round And there is no reason at all why you can't leave here with me In the meantime, stay, let me watch you break it down and Dance Gonna be okay, da-da-doo-doot-n (Oh) Just dance (Ooh, yeah) Spin that record, babe, da-da-doo-doot-n Just dance (Ooh, yeah) Gonna be okay, da-da-doo-doot-n (Ooh, yeah) Just dance (Ooh, yeah) Spin that record, babe, da-da-doo-doot-n Just dance (Oh) Gonna be okay, da-da-da-dance (Gonna be okay) Dance, dance (Yeah) Just, j-j-just dance (Oh-oh) Incredible Amazing Music Woo! Let's go! Half psychotic, sick, hypnotic, got my blueprint, it's symphonic Half psychotic, sick, hypnotic, got my blueprint, electronic Half psychotic, sick, hypnotic, got my blueprint, it's symphonic Half psychotic, sick, hypnotic, got my blueprint, electronic Go, use your muscle, carve it out, work it, hustle (I got it, just stay close enough to get it on) Don't slow, drive it, clean it, Lysol, bleed it Spend the last dough (I got it) in your pock-o (I got it) Just dance (Da-dance, oh) Gonna be okay, da-da-doo-doot-n Just dance Spin that record, babe, da-da-doo-doot-n Just dance (Baby) Gonna be okay, da-da-doo-doot-n Just dance Spin that record, babe, da-da-doo-doot-n (Oh, baby, yeah) Just dance Gonna be okay (Spin that record, baby, yeah) Da-da-da-dance, dance, dance Just, j-j-just dance"
Garden Of Eden,Lady Gaga,2025-03-07,87,False,239.72,4mUR5Tv0CvJtpmnUtzeIgd,"Ah-ah-ah-ah, oh-oh-oh-oh Go get your friends and meet me on the floor You're out of candy, I can get you mo-o-ore You started slurrin', and I start to squeal I'm fallin' over in my nine-inch heels Come on (So hit the lights) Come on and hit me, come on (DJ, hit the lights) DJ, come on (So hit the lights) Come on and hit me, come on (DJ, hit the lights) I could be your girlfriend for the weekend You could be my boyfriend for the night My excuse to make a bad decision Bodies gettin' close under the lights (Oh) I've been feelin' this familiar feeling Like I've known you my wholе life (Oh) Take you to the Gardеn of Eden Poison apple, take a bite (Oh) I'll t-t-take you to the Garden of Eden (Uh, uh) I'll t-t-take you to the Garden of Eden (Oh) I'll t-t-take you to the Garden of Eden (Uh, uh) I'll t-t-take you to the Garden of Eden You're turnin' green from the adrenaline This chick's a machine, but her friend is way more fun But you can't hear her with the music on So you say ""yes"" and then the party's o-on Come on (So hit the lights) Come on and hit me, come on (DJ, hit the lights) I could be your girlfriend for the weekend You could be my boyfriend for the night My excuse to make a bad decision Bodies getting close under the lights (Oh) I've been feelin' this familiar feeling Like I've known you my whole life (Oh) Take you to the Garden of Eden Poison apple, take a bite (Oh) I'll t-t-take you to the Garden of Eden (Uh, uh) I'll t-t-take you to the Garden of Eden (Oh) I'll t-t-take you to the Garden of Eden (Uh, uh) I'll t-t-take you to the Garden of Eden (Come on) (So hit the lights) Come on and hit me, come on (DJ, hit the lights) Oh (Come on) (So hit the lights) Come on and hit me, come on (DJ, hit the lights) Oh I could be your girlfriend for the weekend You could be my boyfriend for the night My excuse to make a bad decision Bodies getting close under the lights (Oh) I've been feelin' this familiar feeling Like I've known you my whole life (Whole life) (Oh) Take you to the Garden of Eden Poison apple, take a bite (Take a bite) (Oh) I'll t-t-take you to the Garden of Eden (Uh, uh) I'll t-t-take you to the Garden of Eden (Oh) I'll t-t-take you to the Garden of Eden (Uh, uh) I'll t-t-take you to the Garden of Eden Uh, uh Ooh Oh Yeah"
Bad Romance,Lady Gaga,2009-11-05,86,False,294.573,0SiywuOBRcynK0uKGWdCnn,"Oh, caught in a bad romance Oh, caught in a bad romance Ra, ra, ah-ah-ah Roma, roma-ma Gaga, ooh, la, la Want your bad romance Ra, ra, ah-ah-ah Roma, roma-ma Gaga, ooh, la, la Want your bad romance I want your ugly, I want your disease I want your everything as long as it's free I want your love Love, love, love, I want your love, ayy I want your drama, the touch of your hand (Hey) I want your leather-studded kiss in the sand I want your love Love, love, love, I want your love (Love, love, love, I want your love) You know that I want you And you know that I need you I want it bad, your bad romance I want your love and I want your revenge You and me could write a bad romance (Oh) I want your love and all your lover's revenge You and me could write a bad romance Oh, caught in a bad romance Oh, caught in a bad romance Ra, ra, ah-ah-ah Roma, roma-ma Gaga, ooh, la, la Want your bad romance I want your horror, I want your design 'Cause you're a criminal as long as you're mine I want your love Love, love, love, I want your love I want your psycho, your vertigo schtick (Hey) Want you in my rear window, baby, you're sick I want your love Love, love, love, I want your love (Love, love, love, I want your love) You know that I want you And you know that I need you ('Cause I'm a free bitch, baby) I want it bad, your bad romance I want your love and I want your revenge You and me could write a bad romance (Oh) I want your love and all your lover's revenge You and me could write a bad romance Oh, caught in a bad romance Oh, caught in a bad romance Ra, ra, ah-ah-ah Roma, roma-ma Gaga, ooh, la, la Want your bad romance Ra, ra, ah-ah-ah Roma, roma-ma Gaga, ooh, la, la Want your bad romance Walk, walk, fashion, baby Work it, move that bitch crazy Walk, walk, fashion, baby Work it, move that bitch crazy Walk, walk, fashion, baby Work it, move that bitch crazy Walk, walk, passion, baby Work it, I'm a free bitch, baby I want your love and I want your revenge I want your love, I don't wanna be friends Je veux ton amour et je veux ta revanche Je veux ton amour, I don't wanna be friends (Oh) (I want your bad romance, I want your bad romance) No, I don't wanna be friends (Caught in a bad romance) (I want your bad romance, I want your bad romance) I don't wanna be friends (Oh) (I want your bad romance, I want your bad romance) Want your bad romance (I want your bad romance) Caught in a bad romance Want your bad romance I want your love and I want your revenge You and me could write a bad romance (Oh) I want your love and all your lover's revenge You and me could write a bad romance Oh (Want your bad romance) Caught in a bad romance (Want your bad romance) Oh (Want your bad romance) Caught in a bad romance Ra, ra, ah-ah-ah Roma, roma-ma Gaga, ooh, la, la Want your bad romance"
Disease,Lady Gaga,2025-03-07,82,False,229.997,0T3Hw3kPj9T2E4UoaSXmfn,"(Ah) (Ah) There are no more tears to cry I heard you begging for life Running out of medicine You're worse than you've ever been (Ah-ah) Screaming for me, baby (Ah-ah) Like you're gonna die (Ah-ah) Poison on the inside I could be your antidote tonight (Ah-ah) Screaming for me, baby (Ah-ah) Like you're gonna die (Ah-ah) Poison on the inside I could be your antidote tonight I could play the doctor, I can cure your disease If you were a sinner, I could make you believe Lay you down like one, two, three Eyes roll back in ecstasy I can smell your sickness, I can cure your (Cure) Cure your disease You're so tortured when you sleep Plagued with all your memories You reach out, and no one's there Like a god without a prayer (Ah-ah) Screaming for me, baby (Ah-ah) Like you're gonna die (Ah-ah) Poison on the inside I could be your antidote tonight (Ah-ah) Screaming for me, baby (Ah-ah) Like you're gonna die (Ah-ah) Poison on the inside I could be your antidote tonight I could play the doctor, I can cure your disease If you were a sinner, I could make you believe Lay you down like one, two, three Eyes roll back in ecstasy I can smell your sickness, I can cure your (Cure) Cure your disease (Ah) (Ah) Cure your disease (Ah) I can smell your sickness, I can cure your— Bring me your desire, I can cure your disease If you were a sinner, I could make you believe Lay you down like one, two, three Eyes roll back in ecstasy I know all your secrets, I can cure your, oh Cure your disease (Ah) Cure your disease (Ah) Cure your— (Ah) I can smell your sickness, I can cure your— I can cure your disease (Ah) Cure your disease (Ah) Cure your disease (Ah) Ooh (Ah) Ooh"
Always Remember Us This Way,Lady Gaga,2018-10-05,86,False,210.2,2rbDhOo9Fh61Bbu23T2qCk,"That Arizona sky Burnin' in your eyes You look at me and, babe, I wanna catch on fire It's buried in my soul Like California gold You found the light in me that I couldn't find So when I'm all choked up and I can't find the words Every time we say goodbye, baby, it hurts When the sun goes down And the band won't play I'll always remember us this way Lovers in the night Poets tryna write We don't know how to rhyme, but damn, we try But all I really know You're where I wanna go The part of me that's you will never die So when I'm all choked up and I can't find the words Every time we say goodbye, baby, it hurts When the sun goes down And the band won't play I'll always remember us this way Oh, yeah I don't wanna be just a memory, baby, yeah So when I'm all choked up and I can't find the words Every time we say goodbye, baby, it hurts When the sun goes down and the band won't play I'll always remember us this way, way, yeah When you look at me and the whole world fades I'll always remember us this way"
Shallow,"Lady Gaga, Bradley Cooper",2018-10-05,85,True,215.733,2VxeLyX666F8uXCJ0dZF8B,"Tell me somethin', girl Are you happy in this modern world? Or do you need more? Is there somethin' else you're searchin' for? I'm fallin' In all the good times, I find myself longin' For change And, in the bad times, I fear myself Tell me something, boy Aren't you tired tryna fill that void? Or do you need more? Ain't it hard keepin' it so hardcore? I'm falling In all the good times, I find myself longing For change And, in the bad times, I fear myself I'm off the deep end, watch as I dive in I'll never meet the ground Crash through the surface where they can't hurt us We're far from the shallow now In the sha-ha, sha-hallow In the sha-ha, sha-la-la-la-low In the sha-ha, sha-hallow We're far from the shallow now Oh, ha, ah, ha Oh-ah, ha I'm off the deep end, watch as I dive in I'll never meet the ground Crash through the surface where they can't hurt us We're far from the shallow now In the sha-ha, shallow In the sha-ha, sha-la-la-la-low In the sha-ha, shallow We're far from the shallow now"
