song_title,artists,release_date,popularity,is_collaboration,duration_seconds,spotify_id,lyrics
Rockabye (feat. Sean Paul & Anne-Marie),"Clean Bandit, Anne-Marie, Sean Paul",2018-11-30,77,True,251.173,2hrUO4drrO63i7FYbCLBl2,"Call it love and devotion Call it a mom's adoration, foundation A special bond of creation, ha For all the single moms out there Goin' through frustration Clean Bandit, Sean da Paul Anne-Marie, sing, make them hear She works the nights by the water She's gone astray, so far away From her father's daughter She just wants a life for her baby All on her own, no one will come She's got to save him (Daily struggle) She tells him, ""Ooh, love No one's ever gonna hurt you, love I'm gonna give you all of my love Nobody matters like you"" (Stay up there, stay up there) She tells him, ""Your life Ain't gon' be nothin' like my life (Straight) You're gonna grow and have a good life I'm gonna do what I've got to do"" (Stay up there, stay up there) So rockabye, baby, rockabye I'm gonna rock you Rockabye, baby, don't you cry Somebody's got you Rockabye, baby, rockabye I'm gonna rock you Rockabye, baby, don't you cry Rockabye (No, oh) Rockabye, rocka-rocka-rockabye (Rockabye, yeah, yeah) Rockabye, rocka-rocka-rockabye Single mom, how you doin' out there? Facing the hard life without no fear (Yeah) Just so you know that you really care (Uh) 'Cause any obstacle come, you're well prepared (Oh no) And no, mama, you never shed tear 'Cause you haffi shed things year after year (Na-na-na-na) And you give the yout love beyond compare (Yeah) You find his school fee and the bus fare (Yeah) Mm, already pops disappear Inna rum bar, can't find him nowhere Steadily your workflow heavily, you know So you nah stop, no time, no time for ya dear Now she got a six-year-old Tryin' to keep him warm Tryin' to keep out the cold When he looks in her eyes He don't know he is safe when she says ""Ooh, love No one's ever gonna hurt you, love I'm gonna give you all of my love Nobody matters like you"" So rockabye, baby, rockabye I'm gonna rock you Rockabye, baby, don't you cry Somebody's got you Rockabye, baby, rockabye I'm gonna rock you Rockabye, baby, don't you cry (Bada-bang-bang-bang, alright then) Rockabye (No, oh) Rockabye, rocka-rocka-rocka-bye (Rockabye, yeah, yeah) Rockabye, rocka-rocka-rocka-bye Rockabye, don't bother cry Lift up your head, lift it up to the sky, yo Rockabye, don't bother cry Angels surround you, just dry your eye Now she got a six-year-old Tryin' to keep him warm Tryin' to keep out the cold When he looks in her eyes He don't know he is safe when she says She tells him, ""Ooh, love No one's ever gonna hurt you, love I'm gonna give you all of my love Nobody matters like you"" (Stay up there, stay up there) She tells him, ""Your life Ain't gon' be nothin' like my life (Straight) You're gonna grow and have a good life I'm gonna do what I got to do"" (Yeah) So, rockabye, baby, rockabye (Rockabye, rocka-rocka-rockabye) I'm gonna rock you Rockabye, baby, don't you cry (Rockabye, rocka-rocka-rockabye) Somebody's got you Rockabye, baby, rockabye (Rockabye, rocka-rocka-rockabye) I'm gonna rock you Rockabye, baby, don't you cry (Bada-bang-bang-bang, alright then) Rockabye Rockabye, don't bother cry Lift up your head, lift it up to the sky (Rockabye) Rockabye, don't bother cry (Yeah, yeah) Angels surround you, just dry your eye (Rockabye) Rockabye, don't bother cry (No, oh) Lift up your head, lift it up to the sky (Rockabye) Rockabye, don't bother cry Angels surround you, just dry your eye"
FRIENDS,"Marshmello, Anne-Marie",2018-02-09,77,True,202.62,08bNPGLD8AhKpnnERrAc6G,"Ooh-oh, ooh-woo Ooh-oh, ooh-woo You say you love me, I say you crazy We're nothing more than friends You're not my lover, more like a brother I known you since we were like ten, yeah Don't mess it up, talking that shit Only gonna push me away, that's it! When you say you love me, that make me crazy Here we go again Don't go look at me with that look in your eye You really ain't going away without a fight You can't be reasoned with, I'm done being polite I've told you one, two, three, four, five, six thousand times Haven't I made it obvious? Haven't I made it clear? Want me to spell it out for you? F-R-I-E-N-D-S Haven't I made it obvious? (Ooh-oh, ooh-wooh) Haven't I made it clear? Want me to spell it out for you? (Ooh-oh, ooh-wooh) F-R-I-E-N-D-S F-R-I-E-N-D-S Have you got no shame? You looking insane Turning up at my door (Ah) It's two in the morning, the rain is pouring Haven't we been here before? (Ah) Don't mess it up, talking that shit Only gonna push me away, that's it! (Ah) Have you got no shame? You looking insane Here we go again So don't go look at me with that look in your eye You really ain't going away without a fight You can't be reasoned with, I'm done being polite I've told you one, two, three, four, five, six thousand times Haven't I made it obvious? (Haven't I made it?) Haven't I made it clear? (Haven't I made it clear?) Want me to spell it out for you? F-R-I-E-N-D-S Haven't I made it obvious? (Ooh, ooh-woah) Haven't I made it clear? (Haven't I?) Want me to spell it out for you? (To spell it out for you?) F-R-I-E-N-D-S F-R-I-E-N-D-S F-R-I-E-N-D-S That's how you **** spell ""friends"" F-R-I-E-N-D-S Get that shit inside your head No, no, yeah, uh, ah F-R-I-E-N-D-S We're just friends So don't go look at me (No) with that look in your eye You really ain't going nowhere without a fight (A fight, nah, nah) You can't be reasoned with, I'm done being polite I've told you one, two, three, four, five, six thousand times Haven't I made it obvious? (Have I not made it obvious?) Haven't I made it clear? (Yeah, I made it very clear) Want me to spell it out for you? (Yo) F-R-I-E-N-D-S (I said F-R-I-E-N-D-S) Haven't I made it obvious? (I made it very obvious) Haven't I made it clear? (I made it very clear) Want me to spell it out for you? F-R-I-E-N-D-S F-R-I-E-N-D-S Mmm, ooh, ooh, ooh Ah, ah-oh, ah-oh"
Cry Baby,"Clean Bandit, Anne-Marie, David Guetta",2024-08-09,70,True,157.086,7oDSG2Q9RBU0QjgtfYQOdD,"I know what you did last night I called you up and you declined I smell perfume, but it ain't mine It's not okay, but it's alright 'Cause you telling so many lies, I gotta let you go Now you know what it's like to be all alone Tell me, how you gonna hurt the one that loves you the most? 'Cause your tears gon' cry a river, go, let it flow Don't want no cry baby at my door, I'll let him go Boy, I ain't the same girl I was before You're only crying 'cause I don't want you back no more Boy, you had your chance And you can keep on cryin', baby I know you been lyin', baby So you can keep on cryin', baby I don't know what you're waiting for I packed your bags outside the door, uh No, I don't wanna sit and talk Can you hurry up? I'm bored 'Cause you telling so many lies, I gotta let you go, mm Now you know what it's likе to be all alone Tell mе, how you gonna hurt the one that loves you the most? Yeah, 'cause your tears gon' cry a river, go, let it flow Don't want no cry baby at my door, I'll let him go Boy, I ain't the same girl I was before (No, I ain't the same) You're only crying 'cause I don't want you back no more (I don't want you back) Boy, you had your chance (Ha-ha) And you can keep on cryin', baby (Oh-oh) I know you been lyin', baby (Oh-oh, mm) So you can keep on cryin', baby You can keep on cryin', baby boy I know you been I know you been lyin', baby So you can keep on cryin', baby"
UNHEALTHY (feat. Shania Twain),"Anne-Marie, Shania Twain",2023-07-28,63,True,149.653,2Z5EUCXngeoYD7wmJBcJv1,"Well, your love is worse, worse than cigarettes Even if I had twenty in my hands Oh, babe, your touch, it hurts more than hangovers No, that bottle don't hold the same regret And my mother says that you're bad for me Guess she never felt the high we're on right now And my father says I should run away But he don't know that I just don't know how Well, if it's unhealthy, then I don't give a damn 'Cause even if it kills me, I'll always take your hand It's unhealthy, they just don't understand And when thеy try to stop me, just know nobody can You're still gon' be my man Eh, еh, eh Still gon' be my man Eh, eh, eh Oh, this body high gives me sleepless nights It's a million times what any drug could give And my red eyes, they are twice as wide It might look like pain, but to me, it's bliss All my friends, they say that you're bad for me Guess they never felt the high we're on right now And my sister says I should run away But she don't know that I just don't know how Well, if it's unhealthy, then I don't give a damn 'Cause even if it kills me, I'll always take your hand It's unhealthy, they just don't understand And when they try to stop me, just know nobody can You're still gon' be my man Eh, eh, eh Still gon' be my man (Still gon') Eh, eh, eh (Still gon' be my man) You're still gon' be my man Eh, eh, eh (Still gon' be my, still gon' be my, be my man) Still gon' be my man Eh, eh, eh (Still gon' be my, still gon' be my, be my man) You're still gon' be my man"
Ciao Adios,Anne-Marie,2018-04-27,67,False,199.773,01BC4Xj5tfsfV8DLDrma7q,"Yeah, yeah, yeah, yeah, yeah Uh Ask you once, ask you twice now There's lipstick on your collar You say she's just a friend now Then why don't we call her? So you wanna go home with someone To do all the things you used to do to me I swear, I know you do Used to take me out, in your fancy car And make out in the rain And when I ring you up Don't know where you are 'Til I hear her say your name Used to sing along, when you played guitar That's a distant memory Hope she treats you better than you treated me, ha I'm onto you, yeah, you I'm not your number one I saw you, with her Kissing and having fun If you're giving her all of your money and time I'm not gonna sit here wasting mine on you, yeah, you Ciao adios, I'm done, uh Ciao adios, I'm done Ciao adios, I'm done After three, after four times Why did I bother? Tell me how many more times Does it take to get smarter? Don't need to deny the hurt and the lies And all of the things you did to me I swear, I know you did Now you take her out, in your fancy car And make out in the rain And when she rings you up She know where you are But I know differently Now she sings along, when you play guitar Making brand new memories Hope you treat her better than you treated me I'm onto you, yeah, you I'm not your number one (yeah) I saw you, with her (with her) Kissing and having fun If you're giving her all of your money and time I'm not gonna sit here wasting mine on you, yeah, you (yeah, yeah) Ciao adios, I'm done (I'm done) Ciao adios, I'm done (yeah, yeah, no, no, no, no) Ciao adios, I'm done (I'm done) If you're giving her all of your money and time I'm not gonna sit here wasting mine on you, yeah, you (yeah, yeah) Ciao adios, I'm done And now you take her out, in your fancy car And make out in the rain And when she rings you up She know where you are But I know differently Now she sings along, when you play guitar Making brand new memories Hope you treat her better than you treated me I'm onto you, yeah, you I'm not your number one I saw you, with her (with her) Kissing and having fun (having fun) If you're giving her all of your money and time (money and time) I'm not gonna sit here wasting mine on you, yeah, you (wasting mine) Ciao adios, I'm done (I'm done) Yeah, ciao adios, I'm done (Uh, you get on with your life) Ciao adios, I'm, I'm done (I'll get on with my life) If you're giving her all of your money and time I'm not gonna sit here wasting mine on you, yeah, you Ciao adios, I'm done"
Our Song,"Anne-Marie, Niall Horan",2021-07-23,62,True,163.733,3fGW43fnu3OHEw6ohTC2Bw,"I'll be honest, I'm alright with me Sunday mornings, in my own bedsheets I've been waking up alone, I haven't thought of her for days I'll be honest, it's better off this way But every time I think that I can get you out my head You never ever let me forget, 'cause Just when I think you're gone, hear our song on the radio Just like that, takes me back to the places we used to go And I've been tryin' but I just can't fight it When I hear it I just can't stop smiling I remembеr you're gone, baby, it's just the song on thе radio That we used to know I'll be honest, I'm alright with me Sunday mornings, in my own white tee I've been waking up alone, I haven't thought of him for days I'll be honest, ha, it's better off this way Every time I think that I can get you out my head You never ever let me forget, 'cause Just when I think you're gone, hear our song on the radio Just like that, takes me back to the places we used to go And I've been trying, but I just can't fight it When I hear it I just can't stop smiling I remember you're gone, baby, it's just the song on the radio That we used to know Just when I think you're gone, hear our song on the radio Just like that, takes me back to the places we used to go And I've been trying, but I just can't fight it When I hear it I just can't stop smiling I remember you're gone, baby, it's just the song on the radio And I've been trying but I just can't fight it (No) When I hear it I just can't stop smiling (Oh, oh) I remember you're gone, baby, it's just the song on the radio That we used to know"
Alarm,Anne-Marie,2018-04-27,64,False,205.593,572xshmOviSGH70oPYMCZV,"You lay here with me, you're shuttin' down I smell her on ya, I'm focused now I know what's goin' on in your head, yeah I know what's happened here in our bed, yeah Your phone is buzzin', so pick it up I know she callin', so what the fuck? I should've known a cheat stays a cheater So here we are And there goes the alarm ringin' in my head Like somebody said, ""Don't you trust him, no"" Text in from his ex, what did you expect? Now you're lyin' here knowin' where he goes Now he got that itch, yeah, karma is a bitch, yeah Same way that they come, that's the way they go Now he got that itch, yeah, rewindin' the picture There goes the alarm and the sirens go There goes the alarm I saw it comin', I let it go My girls will tell me, ""I told you so"" But I was so intrigued by your style, boy Always been a sucker for a wild boy I'm better than this, I know my worth I might be gettin' what I deserve But I ain't stickin' 'round for the re-run What's done is done And there goes the alarm ringin' in my head Like somebody said, ""Don't you trust him, no"" Text in from his ex, what did you expect? Now you're lyin' here knowin' where he goes Now he got that itch, yeah, karma is a bitch, yeah Same way that they come, that's the way they go Now he got that itch, yeah, rewindin' the picture There goes the alarm and the sirens go There goes the alarm Now he got that itch, yeah Same way that they come Now he got that itch, yeah There goes the alarm, yeah Same way that they come Now he got that itch, yeah, yeah, uh Bang bang, two-shots fired Man down, one fool, one liar Ring ring, trust gone missin' House on fire, house on fire Bang bang, two-shots fired Man down, one fool, one liar Ring ring, trust gone missin' House on fire And there goes the alarm ringin' in my head Like somebody said, ""Don't you trust him, no"" (No) Text in from his ex, what did you expect? Now you're lyin' here knowin' where he goes Now he got that itch, yeah, karma is a bitch, yeah Same way that they come, that's the way they go Now he got that itch, yeah, rewindin' the picture There goes the alarm and the sirens go There goes the alarm Now he got that itch, yeah There goes the alarm There goes the alarm Now he got that itch, yeah There goes the alarm There goes the alarm"
This Town,Niall Horan,2017-10-20,80,False,232.852,0qvzXomUDJVaUboy2wMfiS,Waking up to kiss you and nobody’s there The smell of your perfume still stuck in the air It’s hard Yesterday I thought I saw your shadow running round It’s funny how things never change in this old town So far from the stars And I want to tell you everything The words I never got to say the first time around And I remember everything From when we were the children playing in this fairground Wish I was there with you now If the whole world was watching I’d still dance with you Drive highways and byways to be there with you Over and over the only truth Everything comes back to you I saw that you moved on with someone new In the pub that we met he’s got his arms around you It’s so hard So hard And I want to tell you everything The words I never got to say the first time around And I remember everything From when we were the children playing in this fairground Wish I was there with you now Because if the whole world was watching I’d still dance with you Drive highways and byways to be there with you Over and over the only truth Everything comes back to you You still make me nervous when you walk in the room Them butterflies they come alive when I’m next to you Over and over the only truth Everything comes back to you And I know that it’s wrong That I can’t move on But there’s something about you If the whole world was watching I’d still dance with you Drive highways and byways to be there with you Over and over the only truth Everything comes back to you You still make me nervous when you walk in the room Them butterflies they come alive when I’m next to you Over and over the only truth Everything comes back to you Everything comes back to you
Slow Hands,Niall Horan,2017-10-20,76,False,188.174,2cOUlop2ZakjOKe4WinesN,"(Woo) ""We should take this back to my place"" That's what she said right to my face 'Cause I want you bad Yeah, I want you, baby I've been thinkin' 'bout it all day And I hope you feel the same way, yeah 'Cause I want you bad Yeah, I want you, baby Slow, slow hands Like sweat drippin' down our dirty laundry No, no chance That I'm leavin' here without you on me I, I know Yeah, I already know that there ain't no stoppin' Your plans and those Slow hands (Woo) Slow hands I just wanna take my time We could do this, baby, all night, yeah 'Cause I want you bad Yeah, I want you, baby Slow, slow hands Like sweat drippin' down our dirty laundry No, no chance That I'm leavin' here without you on me I, I know Yeah, I already know that there ain't no stoppin' Your plans and those Slow hands (Woo) Fingertips puttin' on a show Got me now and I can't say no Wanna be with you all alone Take me home, take me home Fingertips puttin' on a show Can't you tell that I want you, baby, yeah Slow hands Like sweat drippin' down our dirty laundry No, no chance That I'm leavin' here without you on me I, I know Yeah, I already know that there ain't no stoppin' Slow hands Like sweat drippin' down our dirty laundry No, no chance That I'm leavin' here without you on me I, I know Yeah, I already know that there ain't no stoppin' Your plans and those Slow hands (Woo) Yeah, slow hands Ooh, slow hands"
Heaven,Niall Horan,2023-06-09,74,False,186.043,5FQ77Cl1ndljtwwImdtjMy,"Strange light revolves around you You float across the room Your touch is made of something Heaven can't hold a candle to You're made of something new Let's not get complicated Let's just enjoy the view It's hard to be a human So much to put an answer to But that's just what we do God only knows where this could go And even if our love starts to grow out of control And you and me go up in flames Heaven won't be the same I'm having revelations You dance across the floor Beyond infatuation How I obsessively adore you That's what I do I believe, I believe I could die in your kiss No, it doesn't get, doesn't get Better than this God only knows where this could go And even if our love starts to grow out of control And you and me go up in flames Heaven won't be the same God only knows where this could go And even if our love starts to grow out of control And you and me go up in flames Heaven won't be the same (Heaven won't be the same) I believe, I believe I could die in your kiss No, it doesn't get, doesn't get Better than, better than this God only knows where this could go And even if our love starts to grow out of control (Even if our love) And you and me go up in flames Heaven won't be the same God only knows where this could go And even if our love starts to grow out of control And you and me go up in flames Heaven won't be the same"
Moral of the Story (feat. Niall Horan) - Bonus Track,"Ashe, Niall Horan",2021-05-07,68,True,198.515,5v6qYImm5k36GHlFxdEZyv,Lyrics not in English
Put A Little Love On Me,Niall Horan,2020-03-13,67,False,224.585,7LyBwug9tJgbaEzRCqtY78,"We fight, we get high holdin' on to love We came down 'cause there was nothing holdin' us Is it wrong that I still wonder where you are? Is it wrong that I still don't know my heart? Are you all dressed up but with nowhere to go? Are your tears falling down when the lights are low? Another Friday night tryna put on a show Do you hate the weekend 'cause nobody's callin'? I've still got so much love hidden beneath this skin So, darlin' Put a little love on me Put a little love on me When the lights come up and there's no shadows dancin' I look around as my heart is collapsin' 'Cause you're the only one I need To put a little love on me We wrote and we wrote Till there were no more words We laughed and we cried Until we saw our worst Is it wrong that I still wonder where you are? Is it wrong that I still don't know my heart? Are you all dressed up but with nowhere to go? Are your tears falling down when the lights are low? Another Friday night tryna put on a show Do you hate the weekend 'cause nobody's callin'? I've still got so much love hidden beneath this skin Will someone Put a little love on me? Ayy Put a little love on me When the lights come up and there's no shadows dancin' I look around as my heart is collapsin' 'Cause you're the only one I need To put a little love on me Last night I lay awake Stuck on the things we say And when I close my eyes The first thing I hear you say is Put a little love on me, ayy Put a little love on me When the lights come up we're the only ones dancing I look around and you're standing there asking You say, ""You're the only one I need So put your love on me"" You're the only one I need Put your love on me"
Nice To Meet Ya,Niall Horan,2020-03-13,64,False,158.805,0DrFTaAX2srXPkuag35djb,"I like the way you talk, I like the things you wear I want your number tattooed on my arm in ink, I swear 'Cause when the morning comes, I know you won't be there Every time I turn around, you disappear I wanna blow your mind, just come with me, I swear I'm gonna take you somewhere warm, you know j'adore la mer 'Cause when the morning comes, I know you won't be there Every time I turn around, you disappear (I got love for you) (I got love for you) Nice to meet ya (I got love for you) (I got love for you) Nice to meet ya, what's your name? Let me treat ya to a drink I like the way you talk, I like the things you wear I want your number tattooed on my arm in ink, I swear 'Cause when the morning comes, I know you won't be there And every time I turn around, you disappear (I got love for you) (I got love for you) Nice to meet ya (I got love for you) (I got love for you) One minute, you're there, the next one, you're gone Been waiting for you all night, so come on You know what I need, you know what I want You know what I need now You know what I need now Nice to meet ya, what's your name? Let me treat ya to a drink Nice to meet ya (I got love for you) Where ya been? (I got love for you) Let me treat ya (I got love for you) To a drink (I got love for you) Nice to meet ya"
Too Much To Ask,Niall Horan,2017-10-20,67,False,223.043,39jXnbACjiaiTwwhsr5sY5,"Waitin' here for someone Only yesterday, we were on the run You smile back at me and your face lit up the Sun Now I'm waitin' here for someone And, oh, love, do you feel this rough? Why's it only you I'm thinkin' of? My shadow's dancin' Without you for the first time My heart is hopin' You'll walk right in tonight And tell me there are things that you regret 'Cause, if I'm bein' honest, I ain't over you yet That's all I'm askin' Is it too much to ask? Is it too much to ask? Someone's movin' outside The lights come on down the drive I forget you're not here when I close my eyes Do you still think of me sometimes? And, oh, love, watch the Sun comin' up Don't it feel fucked up we're not in love? My shadow's dancin' Without you for the first time My heart is hopin' You'll walk right in tonight And tell me there are things that you regret 'Cause, if I'm bein' honest, I ain't over you yet That's all I'm askin' Is it too much to ask? My shadow's dancin' Without you for the first time My heart is hopin' You'll walk right in tonight And tell me there are things that you regret 'Cause, if I'm bein' honest, I ain't over you yet My shadow's dancin' Without you for the first time My heart is hopin' You'll walk right in tonight And tell me there are things that you regret 'Cause, if I'm bein' honest, I ain't over you yet That's all I'm askin' Is it too much to ask? That's all I'm askin' Is it too much to ask? That's all I'm askin' Is it too much to ask?"
